"journal-article-10.2307_43610830-ngram1.txt","COMMUNITY SERVICE VERSUS ELECTRONIC MONITORING—WHAT WORKS BETTER?: Results of a Randomized Trial"
"journal-article-10.2307_4494574-ngram1.txt","Freedom of Assembly, Consequential Harms and the Rule of Law: Liberty-limiting Principles in the Context of Transition"
"book-chapter-10.7758_9781610441483.14-ngram1.txt","book-chapter-10.7758_9781610441483.14-ngram1.txt"
"journal-article-10.2307_20159734-ngram1.txt","Can Businesses Effectively Regulate Employee Conduct? The Antecedents of Rule following in Work Settings"
"journal-article-10.2307_27715586-ngram1.txt","The Place of Medicine in the American Prison: Ethical Issues in the Treatment of Offenders"
"journal-article-10.2307_40971938-ngram1.txt","The \"Desert\" Model for Sentencing: Its Influence, Prospects, and Alternatives"
"journal-article-10.2307_24887518-ngram1.txt","An Exploratory Study Comparing the Effectiveness of Lecturing versus Team-based Learning"
"journal-article-10.2307_3329754-ngram1.txt","Uncooperative Federalism: The Failure of the Bureau of Investigation's Intergovernmental Attack on Radicalism"
"journal-article-10.2307_42745222-ngram1.txt","News that Counts: Newspaper Images of Crime and Victimization Statistics"
"book-chapter-10.2307_j.ctt1t88znm.23-ngram1.txt","book-chapter-10.2307_j.ctt1t88znm.23-ngram1.txt"
"journal-article-10.2307_20877501-ngram1.txt","MINORITIES AS VICTIMS OF POLICE SHOOTINGS: INTERPRETATIONS OF RACIAL DISPROPORTIONALITY AND POLICE USE OF DEADLY FORCE"
"journal-article-10.2307_800471-ngram1.txt","Formal and Informal Sanctions: A Comparison of Deterrent Effects"
"journal-article-10.2307_26297254-ngram1.txt","AboutPerspectives on Terrorism"
"journal-article-10.2307_3033721-ngram1.txt","Sanctioning the High-Status Deviant: An Attributional Analysis"
"journal-article-10.2307_3173657-ngram1.txt","Back Matter"
"journal-article-10.1525_sop.2010.53.4.527-ngram1.txt","Weighing the Consequences of a Deviant Career: Factors Leading to an Exit From Prostitution"
"journal-article-10.2307_1141788-ngram1.txt","An Analysis of Police Killed by Criminal Action: 1961-1963"
"journal-article-10.2307_1394313-ngram1.txt","Psychiatric Hospitalization History and Parole Decisions"
"journal-article-10.2307_3323245-ngram1.txt","Crime and Socio-Economic Context"
"journal-article-10.2307_4106364-ngram1.txt","Norms, Theories of Punishment, and Publicly Preferred Penalties for Crimes"
"journal-article-10.2307_43735772-ngram1.txt","No Place Like Home: A Qualitative Investigation of Social Support and Its Effects on Recidivism"
"book-chapter-10.5406_j.ctt2ttcqq.6-ngram1.txt","book-chapter-10.5406_j.ctt2ttcqq.6-ngram1.txt"
"journal-article-10.2307_420765-ngram1.txt","Back Matter"
"journal-article-10.2307_43082041-ngram1.txt","Sport Mega Events, Urban Football Carnivals and Securitised Commodification: The Case of the English Premier League"
"journal-article-10.2307_796093-ngram1.txt","The Double Jeopardy Clause as a Bar to Reintroducing Evidence"
"journal-article-10.2307_23263006-ngram1.txt","Front Matter"
"journal-article-10.2307_29762240-ngram1.txt","RELATIONSHIP OF OFFENDER AND VICTIM RACE TO DEATH PENALTY SENTENCES IN CALIFORNIA"
"journal-article-10.2307_3521404-ngram1.txt","HIV Epidemiology and Risk Behavior Promoting HIV Transmission in Austrian Prisons"
"journal-article-10.2307_4134979-ngram1.txt","Steven D. Levitt: 2003 John Bates Clark Medalist"
"journal-article-10.2307_800541-ngram1.txt","Self Definition by Rejection: The Case of Gang Girls"
"book-chapter-10.2307_j.ctt1t89hhq.18-ngram1.txt","book-chapter-10.2307_j.ctt1t89hhq.18-ngram1.txt"
"book-chapter-10.2307_j.ctt8121b.12-ngram1.txt","book-chapter-10.2307_j.ctt8121b.12-ngram1.txt"
"book-chapter-10.7249_j.ctt5vjvzg.11-ngram1.txt","book-chapter-10.7249_j.ctt5vjvzg.11-ngram1.txt"
"book-chapter-10.7758_9781610441247.17-ngram1.txt","book-chapter-10.7758_9781610441247.17-ngram1.txt"
"book-chapter-10.7758_9781610447249.14-ngram1.txt","book-chapter-10.7758_9781610447249.14-ngram1.txt"
"journal-article-10.2307_176074-ngram1.txt","The Unloved State: Twentieth-Century Politics in the Writing of Nineteenth-Century History"
"journal-article-10.2307_23365644-ngram1.txt","The Effect of Time Served on Recidivism: An Interdisciplinary Theory"
"journal-article-10.2307_3096919-ngram1.txt","The Baffling Case of the Smoking Gun: The Social Ecology of Political Accounts in the Iran-Contra Affair"
"journal-article-10.2307_4106163-ngram1.txt","Modernization, Structural Characteristics, and Societal Rates of Crime: An Aapplication of Blau's Macrosociological Theory"
"journal-article-10.2307_588692-ngram1.txt","The Deviance of Women: A Critique and an Enquiry"
"journal-article-10.2307_symbinte.36.2.197-ngram1.txt","Discursive Colorlines at Work: How Epithets and Stereotypes are Racially Unequal"
"journal-article-10.2307_23528671-ngram1.txt","Race and the Disappointing Right to Counsel"
"journal-article-10.2307_349440-ngram1.txt","Homicide and the Family"
"journal-article-10.2307_43234550-ngram1.txt","Resistance against the Mafia: A Civic Struggle to Defy an Uncontestable Power"
"journal-article-10.2307_827953-ngram1.txt","The Jury Selection in the Mitchell-Stans Conspiracy Trial"
"journal-article-10.2307_1135157-ngram1.txt","A Quarter Century's Progress in Penal Institutions for Adults in the United States"
"journal-article-10.2307_1394217-ngram1.txt","Recidivism Rates among Child Molesters and Rapists: A Methodological Analysis"
"journal-article-10.2307_273868-ngram1.txt","Racial Group Membership, Role Orientation, and Police Conduct among Urban Policemen"
"journal-article-10.2307_2766547-ngram1.txt","News and Notes"
"journal-article-10.2307_1095605-ngram1.txt","Volume Information"
"journal-article-10.2307_23365497-ngram1.txt","Twenty Years of Homicide and Robbery in Chicago: The Impact of the City's Changing Racial and Age Composition"
"journal-article-10.2307_42900490-ngram1.txt","Understanding the Psychosocial Characteristics of Gang-Involved Youths in a System of Care: Individual, Family, and System Correlates"
"book-chapter-10.7758_9781610441919.13-ngram1.txt","book-chapter-10.7758_9781610441919.13-ngram1.txt"
"journal-article-10.2307_20743157-ngram1.txt","And Justice for Some: Race, Crime, and Punishment in the US Criminal Justice System"
"journal-article-10.2307_23367425-ngram1.txt","Overdispersion and Poisson Regression"
"journal-article-10.2307_30015839-ngram1.txt","The Impact of Population Policy upon Social Welfare"
"journal-article-10.2307_3804532-ngram1.txt","Russia's Penal Peripheries: Space, Place and Penalty in Soviet and Post-Soviet Russia"
"book-chapter-10.2307_j.ctt15r3xt2.9-ngram1.txt","book-chapter-10.2307_j.ctt15r3xt2.9-ngram1.txt"
"journal-article-10.2307_1143975-ngram1.txt","Is Justice Just Us? Using Social Science to Inform Substantive Criminal Law"
"journal-article-10.2307_1187231-ngram1.txt","The Law and Exclusion from Schools in Comparative Perspective"
"journal-article-10.2307_174635-ngram1.txt","Toward a Model of Terrorist Behavior in Hostage-Taking Incidents"
"journal-article-10.2307_4285571-ngram1.txt","Into the Upperworld? Law, Crime and Punishment in English Society"
"journal-article-10.2307_42856575-ngram1.txt","Using an Old Search Engine: The Value of \"The Times Index\""
"book-chapter-10.2307_j.ctt9qgspr.14-ngram1.txt","book-chapter-10.2307_j.ctt9qgspr.14-ngram1.txt"
"journal-article-10.1086_517981-ngram1.txt","“Microbes of the Mind”: Moral Contagion in Late Imperial Russia*"
"journal-article-10.2307_2095245-ngram1.txt","Reconciling Race and Class Differences in Self-Reported and Official Estimates of Delinquency"
"journal-article-10.2307_23365492-ngram1.txt","Social Control Theory: The Salience of Components by Age, Gender, and Type of Crime"
"journal-article-10.2307_2779402-ngram1.txt","Community Change and Patterns of Delinquency"
"journal-article-10.2307_29766488-ngram1.txt","Social Justice at the Workplace: The Political Economy of Occupational Health and Safety Laws"
"journal-article-10.2307_4507025-ngram1.txt","Reflections on the Criminological Enterprise"
"journal-article-10.2307_798901-ngram1.txt","An Evaluation of Early Identification and Intensive Treatment Programs for Predelinquents"
"journal-article-10.2307_1095314-ngram1.txt","Barristers and Gentlemen: A Critical Look at Sexism in the Legal Profession"
"journal-article-10.2307_1143048-ngram1.txt","Rationality and Accuracy in the Criminal Process: A Discordant Note on the Harmonizing of the Justices' Views on Burdens of Persuasion in Criminal Cases"
"journal-article-10.2307_1143697-ngram1.txt","Eighth Amendment: Prosecutorial Comment regarding the Victim's Personal Qualities Should Not Be Permitted at the Sentencing Phase of a Capital Trial"
"journal-article-10.2307_23365610-ngram1.txt","Participation in and Frequency of Delinquent Behavior: A Test for Structural Differences"
"journal-article-10.2307_3550634-ngram1.txt","The Young Offenders Act: Children's Rights, Children's Wrongs"
"book-chapter-10.3366_j.ctt1g09whx.16-ngram1.txt","book-chapter-10.3366_j.ctt1g09whx.16-ngram1.txt"
"journal-article-10.2307_1140803-ngram1.txt","Juvenile Delinquency, Maladjustment and Maturity"
"journal-article-10.2307_1142795-ngram1.txt","The Immunity of the United States Attorney General"
"journal-article-10.2307_1566755-ngram1.txt","Harsh Physical Discipline in Childhood and Violence in Later Romantic Involvements: The Mediating Role of Problem Behaviors"
"journal-article-10.2307_23365744-ngram1.txt","Economic Conditions and Punishment in Postbellum Georgia"
"journal-article-10.2307_23639284-ngram1.txt","IT'S NOT WHO YOU KNOW—IT'S WHAT YOU KNOW ABOUT PEOPLE YOU DON'T KNOW THAT COUNTS: Extending the Analysis of Crime Groups as Social Networks"
"journal-article-10.2307_2769616-ngram1.txt","The Process of Urbanization and Criminal Behavior"
"journal-article-10.2307_29768400-ngram1.txt","Fatal Injustice: Rampant Punitiveness, Child Prisoner Deaths, and Institutionalized Denial—A Case for Comprehensive Independent Inquiry in England and Wales"
"journal-article-10.2307_582863-ngram1.txt","Delinquent Females' Perceptions of Their Fathers"
"book-chapter-10.2307_j.ctt5hj7pr.9-ngram1.txt","book-chapter-10.2307_j.ctt5hj7pr.9-ngram1.txt"
"book-chapter-10.2307_j.ctt9qg380.14-ngram1.txt","book-chapter-10.2307_j.ctt9qg380.14-ngram1.txt"
"journal-article-10.2307_2094642-ngram1.txt","Continuity in Delinquency Area Research: A Comparison of Studies for Baltimore, Detroit, and Indianapolis"
"journal-article-10.2307_23635316-ngram1.txt","REFERENCES"
"journal-article-10.2307_43287798-ngram1.txt","Front Matter"
"journal-article-10.5325_jspecphil.24.4.0354-ngram1.txt","The Myth of Penal Populism:"
"journal-article-10.2307_1394390-ngram1.txt","Due Process and the Death Penalty: The Role of Prosecutorial Misconduct in Closing Argument in Capital Trials"
"journal-article-10.2307_41562426-ngram1.txt","Defining Piracy: The Chung Tam Kwong Case and British Piracy Suppression in China in the Early 1930s"
"journal-article-10.2307_44125181-ngram1.txt","Oaths, Ordeals, and the Kenyan Courts: A Policy Analysis"
"journal-article-10.2979_indjglolegstu.20.1.109-ngram1.txt","In the Breach: Citizenship and its Approximations"
"book-chapter-10.2307_j.ctv301ds5.20-ngram1.txt","book-chapter-10.2307_j.ctv301ds5.20-ngram1.txt"
"journal-article-10.2307_3813423-ngram1.txt","The Roles and Rules of Law in Sexual Development"
"journal-article-10.2307_43771520-ngram1.txt","Risk-need Assessment, Sentencing and Minority Ethnic Offenders in Britain"
"book-chapter-10.2307_j.ctt1bmzngg.11-ngram1.txt","book-chapter-10.2307_j.ctt1bmzngg.11-ngram1.txt"
"book-chapter-10.2307_j.ctt1rfsq1z.8-ngram1.txt","book-chapter-10.2307_j.ctt1rfsq1z.8-ngram1.txt"
"book-chapter-10.2307_j.ctv301ds5.13-ngram1.txt","book-chapter-10.2307_j.ctv301ds5.13-ngram1.txt"
"book-chapter-10.5149_9780807839898_flaherty.10-ngram1.txt","book-chapter-10.5149_9780807839898_flaherty.10-ngram1.txt"
"journal-article-10.2307_1020875-ngram1.txt","Bibliography"
"journal-article-10.2307_23366035-ngram1.txt","A Model for Ranking the Punitiveness of the States"
"journal-article-10.2307_29766527-ngram1.txt","Sociolegal Theory and Critical Pedagogy"
"journal-article-10.2307_3341255-ngram1.txt","The Incidence and Prevalence of Woman Abuse in Canadian University and College Dating Relationships"
"journal-article-10.2307_42851993-ngram1.txt","CRIME AT WORK: THE SOCIAL CONSTRUCTION OF AMATEUR PROPERTY THEFT"
"journal-article-10.2307_23637857-ngram1.txt","THE JUSTIFICATIONS OF 'JUSTICE': Legal Practitioners' Accounts of Negotiated Case Settlements in Magistrates' Courts"
"journal-article-10.2307_27718884-ngram1.txt","The Criminalisation of HIV Transmission"
"book-chapter-10.2307_j.ctt2tt7mg.19-ngram1.txt","book-chapter-10.2307_j.ctt2tt7mg.19-ngram1.txt"
"journal-article-10.2307_1318001-ngram1.txt","Are \"Sisters in Crime\" Finally Being Booked? The Coverage of Women and Crime in Journals and Textbooks"
"journal-article-10.2307_2578703-ngram1.txt","Group Size, Heterogeneity, and Intergroup Conflict: A Test of Blau's Inequality and Heterogeneity"
"journal-article-10.2307_2776863-ngram1.txt","Race and Ethnicity Relative to Other Factors in Juvenile Court Dispositions"
"journal-article-10.2307_420857-ngram1.txt","Latino Interests in Education, Health, and Criminal Justice Policy"
"journal-article-10.2307_23638759-ngram1.txt","CRIME, SHAME, AND RECIDIVISM: The Case of Iceland"
"journal-article-10.2307_23639319-ngram1.txt","HOW DO RESIDENTIAL BURGLARS SELECT TARGET AREAS? A New Approach to the Analysis of Criminal Location Choice"
"journal-article-10.2307_25058695-ngram1.txt","Trouble with She-Dicks: Private Eyes and Public Women in \"The Adventures of Loveday Brooke, Lady Detective\""
"journal-article-10.2307_3053969-ngram1.txt","Back Matter"
"journal-article-10.2307_3486660-ngram1.txt","Some Determinants of Property Crime: Economic Factors Influence Criminal Behavior but Cannot Completely Explain the Syndrome"
"journal-article-10.2307_41067430-ngram1.txt","THE BLACK SCHOLAR CLASSIFIED"
"journal-article-10.2307_41563194-ngram1.txt","SHAPING UP TO SHIP OUT IN COLONIAL NEW ZEALAND: RULES, REGULATIONS AND ROUTINES AT THE KOHIMARAMA NAVAL TRAINING SCHOOL"
"journal-article-10.2307_41954119-ngram1.txt","Published Findings from the Spouse Assault Replication Program: A Critical Review"
"journal-article-10.2307_1601026-ngram1.txt","Back Matter"
"journal-article-10.2307_1601667-ngram1.txt","The State of the State: The Model of the Modern State and Its Contemporary Transformation"
"journal-article-10.2307_26326919-ngram1.txt","Linking Public Health, Social Capital, and Environmental Stress to Crime Using a Spatially Dependent Model"
"journal-article-10.2307_795411-ngram1.txt","A Comparison of the Work of Thorsten Sellin and Isaac Ehrlich on the Deterrent Effect of Capital Punishment"
"book-chapter-10.2307_j.ctt9qgkt0.9-ngram1.txt","book-chapter-10.2307_j.ctt9qgkt0.9-ngram1.txt"
"book-chapter-10.2307_j.ctt9qgspr.7-ngram1.txt","book-chapter-10.2307_j.ctt9qgspr.7-ngram1.txt"
"book-chapter-10.3998_mpub.6769.12-ngram1.txt","book-chapter-10.3998_mpub.6769.12-ngram1.txt"
"journal-article-10.2307_23638552-ngram1.txt","BLACK PEOPLE AND SECURE PSYCHIATRIC FACILITIES: Patterns of Processing and the Role of Stereotypes"
"journal-article-10.2307_27862463-ngram1.txt","Quality Assured Science: Managerialism in Forensic Biology"
"journal-article-10.2307_42853265-ngram1.txt","Front Matter"
"journal-article-10.2307_1393934-ngram1.txt","Media Effects on Jurors"
"journal-article-10.2307_43958491-ngram1.txt","Offending Children, Registering Sex"
"journal-article-10.2307_799569-ngram1.txt","The Effects of Legal Processing on Delinquent Orientations"
"journal-article-10.2307_151956-ngram1.txt","The Case of the Vanishing Acquittal: Informal Norms and the Practice of Soviet Criminal Justice"
"journal-article-10.2307_20782353-ngram1.txt","Bibliography"
"journal-article-10.2307_2089047-ngram1.txt","Back Matter"
"journal-article-10.2307_24357886-ngram1.txt","Crime and Violence in an Urbanizing World"
"journal-article-10.2307_2784183-ngram1.txt","Psychological Factors for the Black Defendant in a Jury Trial"
"journal-article-10.2307_800569-ngram1.txt","Gangs, Neighborhoods, and Public Policy"
"journal-article-10.2307_974254-ngram1.txt","Towards a Theory of Criminal Justice Administration: A General Systems Perspective"
"journal-article-10.2307_1049872-ngram1.txt","Cognitive-Behavioral Programs for Offenders"
"journal-article-10.2307_2767101-ngram1.txt","Volume Information"
"journal-article-10.2307_490334-ngram1.txt","Regional Variations in Homicide, Capital Punishment, and Perceived Crime Severity in the United States"
"journal-article-10.1525_fsr.2008.21.1.29-ngram1.txt","Using Sentencing to Clean Up Criminal Procedure: Incorporating Remedial Sentence Reduction into Federal Sentencing Law"
"journal-article-10.2307_1164636-ngram1.txt","Optimal Randomized Response Models and Methods for Hypothesis Testing"
"journal-article-10.2307_2117728-ngram1.txt","Sex and Theories of Deviance: Toward a Functional Theory of Deviant Type-Scripts"
"journal-article-10.2307_2573509-ngram1.txt","Family Status and the Delinquent Child: A Reappraisal and Some New Findings"
"journal-article-10.2307_26423256-ngram1.txt","APPROACHES TO THE DESIGN AND PROVISION OF PRISON ACCOMMODATION AND FACILITIES FOR AUSTRALIAN INDIGENOUS PRISONERS AFTER THE ROYAL COMMISSION INTO ABORIGINAL DEATHS IN CUSTODY"
"book-chapter-10.2307_j.ctt1t898f9.11-ngram1.txt","book-chapter-10.2307_j.ctt1t898f9.11-ngram1.txt"
"journal-article-10.1086_521745-ngram1.txt","From the Inside Out: Therapeutic Penology and Political Liberalism in Postwar California"
"journal-article-10.2307_1142796-ngram1.txt","The Constitutionality of Canine Searches in the Classroom"
"journal-article-10.2307_1144191-ngram1.txt","Democratic Restraints upon the Police"
"journal-article-10.2307_2186553-ngram1.txt","Periodical Literature of International Law"
"journal-article-10.2307_1141059-ngram1.txt","Secret Communications. A Bibliography of Secret Writing and Cryptography"
"journal-article-10.2307_2562136-ngram1.txt","The Geography of Despair"
"journal-article-10.2307_3993141-ngram1.txt","South Africa: The Election and the Transition Process: Five Contradictions in Search of a Resolution"
"journal-article-10.2307_43598496-ngram1.txt","Does the Truth Come Out in the Writing? SCAN as a Lie Detection Tool"
"journal-article-10.2307_20762302-ngram1.txt","Resistance and Adaptation to Criminal Identity: Using Secondary Analysis to Evaluate Classic Studies of Crime and Deviance"
"journal-article-10.2307_23291945-ngram1.txt","Professional Education in a Maximum Security Prison: A Comparative Study"
"journal-article-10.2307_42955815-ngram1.txt","Race, Local Life Circumstances, and Criminal Activity"
"book-chapter-10.7722_j.ctt1wx90zt.8-ngram1.txt","book-chapter-10.7722_j.ctt1wx90zt.8-ngram1.txt"
"journal-article-10.2307_1139509-ngram1.txt","Pioneers in Criminology. III. Isaac Ray (1807-1881)"
"journal-article-10.2307_23720584-ngram1.txt","The Impact of Criminal Conviction Disclosure on the Self-reported Offending Profile of Social Work Students"
"journal-article-10.2307_2380651-ngram1.txt","Book Notes"
"journal-article-10.2307_27919153-ngram1.txt","The Role of Ethical Leadership Versus Institutional Constraints: A Simulation Study of Financial Misreporting by CEOs"
"journal-article-10.2307_29765955-ngram1.txt","MULTI—METHOD RESEARCH ON PUNITIVE CAPTIVITY: A Discussion Based on Insurgent Practicum"
"book-chapter-10.2307_j.ctt1t88zg1.13-ngram1.txt","book-chapter-10.2307_j.ctt1t88zg1.13-ngram1.txt"
"journal-article-10.2307_1142148-ngram1.txt","Age Composition and Patterns of Change in Criminal Statistics"
"journal-article-10.2307_24497545-ngram1.txt","Native American Tribal Gaming as Crime against Nature: Environment, Sovereignty, Globalization"
"journal-article-10.2307_24541777-ngram1.txt","Trafficking, Scandal, and Abuse of Migrant Workers in Argentina and the United States"
"journal-article-10.2307_3491380-ngram1.txt","Front Matter"
"journal-article-10.2307_1599382-ngram1.txt","Front Matter"
"journal-article-10.2307_23253802-ngram1.txt","BOOKS RECEIVED"
"journal-article-10.2307_23639537-ngram1.txt","SETTING THE RECORD STRAIGHT AND A CALL FOR RADICAL CHANGE: A Reply to Annie Cossins on 'Restorative Justice and Child Sex Offences'"
"journal-article-10.2307_3211307-ngram1.txt","Reclaiming Deviance as a Unique Course from Criminology Re-Revisited: Entering Delinquency into the Equation"
"journal-article-10.2307_4028233-ngram1.txt","Ethnology and Colonial Administration in Nineteenth-Century British India: The Question of Native Crime and Criminality"
"journal-article-10.2307_1393680-ngram1.txt","Comparing Females Acquitted by Reason of Insanity, Convicted, and Civilly Committed in Florida: 1977-1984"
"journal-article-10.2307_27889105-ngram1.txt","LE VIOL. NOTE DE LECTURE"
"journal-article-10.2307_40926283-ngram1.txt","Front Matter"
"journal-article-10.2307_1142225-ngram1.txt","Centralization, Democracy, and the Police"
"journal-article-10.2307_23675421-ngram1.txt","SHAKSPERE AND HIS CONTEMPORARIES (A Classified Bibliography for 1939)"
"journal-article-10.2307_23145783-ngram1.txt","Front Matter"
"journal-article-10.2307_23638776-ngram1.txt","REFERENCES: 9th November 2000—30th May 2001"
"journal-article-10.2307_1142397-ngram1.txt","Prosecutor Perceptions of Crime Seriousness"
"journal-article-10.2307_1133099-ngram1.txt","A Working Program for an Adequate System of Collecting Criminal Statistics in Illinois"
"journal-article-10.2307_1137142-ngram1.txt","Committee on Survey of Crime, Criminal Law and Criminal Procedure"
"journal-article-10.2307_1142331-ngram1.txt","The Constitutional Protection of the Swastika"
"journal-article-10.2307_2571407-ngram1.txt","New Books Received"
"journal-article-10.2307_20108722-ngram1.txt","Last Words, Last Meals, and Last Stands: Agency and Individuality in the Modern Execution Process"
"journal-article-10.2307_23898536-ngram1.txt","Ethnic Identity and Delinquency Among Filipino-American Youth: A Theoretical View"
"journal-article-10.2307_41105086-ngram1.txt","Contributions to a History of Criminal Anthropology in Portugal"
"journal-article-10.2307_44026061-ngram1.txt","SOCIAL STIGMA AND THE CRIMINAL GROUP"
"book-chapter-10.2307_j.ctt1q1crtm.9-ngram1.txt","book-chapter-10.2307_j.ctt1q1crtm.9-ngram1.txt"
"journal-article-10.2307_1140564-ngram1.txt","Fiber Tipped Pens"
"journal-article-10.2307_213923-ngram1.txt","Geographical Record"
"journal-article-10.2307_29766253-ngram1.txt","Social Parasitism in Poland: Some Legal Aspects"
"journal-article-10.2307_42851299-ngram1.txt","PHENOMENALISM AND ESSENTIALISM IN THE SOCIOLOGY OF DEVIANCY"
"journal-article-10.2307_3048048-ngram1.txt","List of Books Received"
"journal-article-10.2307_3658566-ngram1.txt","Estimates of Randomized Controlled Trials across Six Areas of Childhood Intervention: A Bibliometric Analysis"
"book-chapter-10.5149_9780807899038_trotti.7-ngram1.txt","book-chapter-10.5149_9780807899038_trotti.7-ngram1.txt"
"journal-article-10.2307_20685041-ngram1.txt","Front Matter"
"journal-article-10.2307_41308942-ngram1.txt","Beyond the Classroom: Internships and Students with Special Needs"
"journal-article-10.2307_41971816-ngram1.txt","Coping With Offender Resistance to Psychoeducational Presentations on the Criminal Lifestyle"
"journal-article-10.2307_43950115-ngram1.txt","Front Matter"
"journal-article-10.2307_1393509-ngram1.txt","Ethical Responsibilities Governing the Statements Experimental Psychologists Make in Expert Testimony"
"journal-article-10.2307_2093176-ngram1.txt","Back Matter"
"journal-article-10.2307_41938310-ngram1.txt","SELECT BIBLIOGRAPHY OF BOOKS (IN ENGLISH) RELATING TO CRIME AND CRIMINOLOGY"
"journal-article-10.2307_42889066-ngram1.txt","'I'm very careful about that': narrative and agency of men in prison"
"book-chapter-10.20851_j.ctt1sq5wqb.10-ngram1.txt","book-chapter-10.20851_j.ctt1sq5wqb.10-ngram1.txt"
"journal-article-10.2307_2277699-ngram1.txt","Statistical News and Notes"
"journal-article-10.2307_23302391-ngram1.txt","CONSTRUCTING AND TESTING A MULTIPLE-THEORY (INTEGRATED) MODEL OF JUVENILE DELINQUENCY"
"journal-article-10.2307_23634996-ngram1.txt","THE MEASUREMENT OF CRIME AND DELINQUENCY IN CANADA: A Replication Study"
"journal-article-10.2307_23638185-ngram1.txt","CAN PRISONS BE LEGITIMATE? \"Penal Politics, Privatization, and the Timeliness of an Old Idea\""
"journal-article-10.2307_25709897-ngram1.txt","PROGRAM FOR THE FIFTY-FIFTH ANNUAL MEETING"
"journal-article-10.2307_43610755-ngram1.txt","DISCIPLINING THE DRIFTER: The Domestication of Travellers in the Netherlands"
"journal-article-10.2307_1279636-ngram1.txt","Sterilization of Mental Defectives"
"journal-article-10.2307_29762462-ngram1.txt","SCIENCE IS TO LAW AS THE BURDEN OF PROOF IS TO SIGNIFICANCE TESTING"
"journal-article-10.2307_3053743-ngram1.txt","Front Matter"
"journal-article-10.2307_3121910-ngram1.txt","The Making of the Dull, Deficient and Backward Pupil in British Elementary Education 1870-1914"
"journal-article-10.2307_41488995-ngram1.txt","Front Matter"
"journal-article-10.2307_173453-ngram1.txt","Images of Conflict Resolution and Social Control: American and Japanese Attitudes toward the Adversary System"
"journal-article-10.2307_20108756-ngram1.txt","Against Prevention? A Response to Harcourt's \"Against Prediction\" on Actuarial and Clinical Predictions and the Faults of Incapacitation"
"journal-article-10.2307_25666681-ngram1.txt","CULTURAL FACTORS IN CRIME AMONG THE DAKOTA INDIANS"
"journal-article-10.2307_2763164-ngram1.txt","Recent Literature"
"journal-article-10.2307_27702123-ngram1.txt","Sociological Manpower and Womanpower: Sex Differences in Career Patterns of Two Cohorts of American Doctorate Sociologists"
"book-chapter-10.2307_j.ctt9qgqmw.9-ngram1.txt","book-chapter-10.2307_j.ctt9qgqmw.9-ngram1.txt"
